ProductID,Name,Description,Price,StockQuantity,CategoryID
7447,station,Arm sign person themselves environmental use. Rule television forward provide.,401.74,29,16
7448,family,Under be how among. Name certain mother yourself right future.,553.6,55,25
7449,administration,Agreement forward have expect before. Opportunity front win feel design treatment center worry.,137.22,74,35
7450,certainly,Tv plan early event major fine generation. Tonight site choose film.,19.76,60,79
7451,company,Trade law service test no method. Painting college seek consumer air special different.,52.06,43,23
7452,eye,Agent south really drive. From idea lot father than under. Become energy modern item.,848.32,69,13
7453,discuss,Thing civil help. Buy clearly treatment whose magazine.,971.85,44,43
7454,manage,Anyone enjoy we campaign. Buy administration pattern.,826.25,38,78
7455,house,Push system late research thus professor prevent. Computer thus practice wife television.,78.0,6,1
7456,evening,Light experience technology moment. Family three reach.,205.41,52,81
7457,former,Itself beyond carry base situation personal. Surface management accept shake behavior local sister.,286.39,46,64
7458,generation,Discuss course month treatment person. Bill provide interest affect two program.,978.45,26,88
7459,international,Natural ten chance. Even must add stage.,787.5,41,4
7460,human,Age card computer medical pattern actually even political. Leader reach of local add itself.,95.7,61,93
7461,how,Its issue open argue poor serve teacher. Citizen short address cold summer.,268.71,59,88
7462,pattern,Seek figure place always allow. Amount anyone economy loss wonder.,34.09,62,79
7463,save,Term life among week fund resource. Wish among toward crime society here relate.,562.78,38,74
7464,give,Five response push may. Look form black analysis.,284.6,65,77
7465,idea,Arm either here marriage listen edge father. Prevent three seat game father.,473.12,60,51
7466,story,Month seek assume officer benefit. Media sing participant young different help buy.,537.92,26,63
7467,mean,Write figure method rise both main really.,558.52,100,9
7468,four,Night perform physical huge result. Food pattern worry hair available.,66.36,28,88
7469,your,Mention establish recently and pass explain speak. Quality Congress beat peace spring.,94.38,26,28
7470,appear,First itself company look. Nor project understand current.,540.66,90,89
7471,inside,Answer single child general I student effect. Century senior since interesting listen value.,508.32,38,71
7472,defense,Of actually use shoulder. Radio me anything collection goal. With each character activity air.,367.49,63,66
7473,president,Technology kid record sure. Level grow unit nor with final none.,554.31,45,2
7474,Mrs,Race body top specific while hard family. Might conference machine skill be whose how despite.,887.33,51,66
7475,difference,Realize bag claim give through both. Head result again suffer. Process among reflect.,998.34,19,4
7476,shake,Son morning base.,804.58,61,98
7477,onto,Season reality form feeling less. Year enough organization each second. Upon way left clearly.,980.51,9,77
7478,economy,Represent meet environmental PM everyone within. Above boy put hair national.,804.15,81,43
7479,budget,Conference ask will message partner production. Baby will good sign agreement effort network.,614.53,99,1
7480,attention,Individual college win effort modern and. Prevent result commercial much nor how relate.,415.01,100,93
7481,issue,"Energy coach her. Add eat dinner actually.
Cell analysis start. Final after wife wrong.",164.65,3,48
7482,society,Member deep book treat fish finally occur. Heart surface animal town quite feel national analysis.,21.18,58,62
7483,loss,Society take hard hit serious response. Big people life anything.,746.8,30,25
7484,cut,Management light especially society. Wife but keep western truth peace low.,560.45,3,5
7485,think,Real star decide difficult be lead.,519.23,83,62
7486,real,Here beautiful radio. Rise machine while usually somebody control.,893.96,39,48
7487,effort,Lose from doctor method. Rich artist stuff. While about else dog politics occur.,341.81,29,16
7488,make,Media baby near clear because least. Evidence avoid family cause surface.,372.24,47,1
7489,right,Claim run action trip. Her military mean. Order option assume music.,797.35,77,88
7490,few,Movement mouth front might by Mrs require. Ready simply detail child sister under.,421.3,68,33
7491,hotel,Heart series state surface list door. Follow way rate her voice.,924.4,95,43
7492,return,Local manage student spring where staff. Myself speak board tonight.,650.12,5,15
7493,shake,Detail bank able face sister store modern.,78.16,60,86
7494,feel,Least success whole expect moment she nation. Both federal mention father prepare remember certain.,826.06,20,16
7495,old,Especially whole inside reveal smile understand grow. Tonight suffer court send and let indicate.,181.68,70,58
7496,popular,Generation think minute thought past amount fine.,686.57,11,28
7497,protect,Staff next rather college send but. Where entire be give meet soldier. Talk small grow also.,194.27,78,53
7498,success,Today near agent me star decade American model.,769.98,1,1
7499,lawyer,Agency professional black fine. Seat part alone situation blood she.,711.15,20,37
7500,section,Few total line seek president.,919.7,55,91
7501,ground,Discover respond view model ball address develop. Program front hard there would green soldier.,126.76,28,26
7502,second,Game environmental save international. Tax discussion property national just. Process gun send.,386.86,0,41
7503,camera,Star report kind policy join win. Successful office official worry reveal about money.,55.29,58,21
7504,trial,Possible Mrs dog fast six fall citizen training. Let pressure trade common expect personal.,871.11,16,61
7505,really,Compare rock often enter image. Three character treat there.,632.35,99,96
7506,purpose,Move all note you people everything top. By later produce course federal loss another.,296.1,34,12
7507,and,Where environment leave magazine very edge. Thank Republican anyone despite risk issue.,858.09,15,16
7508,along,Network idea this consumer. Data source authority. Determine opportunity girl agency give mouth.,882.19,82,7
7509,plant,Card church themselves environment serious expect. Student different general stock night.,94.25,8,53
7510,account,Be suggest service different.,218.79,45,65
7511,protect,Collection any him notice center.,415.72,3,50
7512,cause,Point mission decade third. But similar history you international weight Mrs.,282.73,26,20
7513,my,Raise before trouble. Crime together third final. Officer finally article important.,259.71,1,56
7514,artist,Call threat charge power professor energy while. Environment upon car of mission nothing let form.,471.76,25,59
7515,leave,Sister federal turn. Newspaper heart although assume between prove someone.,460.42,12,66
7516,study,Deal law whether. Store option believe.,31.36,10,24
7517,management,Society direction foot nice animal already. Drop right often none.,252.49,70,84
7518,house,But set per town window human. Better kind evening similar especially suggest partner.,305.74,48,31
7519,culture,Build best finish water own. Fly contain sort.,979.08,73,76
7520,listen,Material would suggest alone agency season. Chair allow loss character risk whose decide about.,127.32,98,36
7521,final,Modern what his. Item many culture cut total for sit.,298.56,72,20
7522,dark,"Score onto she prepare.
South become newspaper grow. During stay turn now baby again floor.",123.19,42,76
7523,despite,There upon the. Effort hit team glass growth news administration stop.,78.61,32,64
7524,matter,Stock other tell. Team land kitchen themselves. Off thousand little fill do watch man.,751.89,71,96
7525,majority,Must at technology. Game one those chance vote remember. Who word able member live cup different.,755.32,50,47
7526,religious,Hear part century agency city. Per much event beat huge. Lot month that enough.,663.55,45,99
7527,building,Police between talk catch recently. Concern factor your pull.,457.91,18,34
7528,travel,Different of write rock book represent these. Build analysis in four.,83.52,62,55
7529,long,Perhaps around name speech agreement.,632.54,77,45
7530,book,Stay truth tell back exactly administration often. Value threat oil recognize eight there office.,316.56,81,14
7531,poor,Way loss focus behavior player. Half even reduce successful rule top difference.,303.32,1,34
7532,base,Ready tend tree about deal huge girl for. Space their develop budget. Line let father we it base.,166.4,77,72
7533,stand,Shake future attorney recent main course. Those executive church have agree participant.,557.72,75,23
7534,week,Arrive whole collection not them middle group. Also rate performance house name degree note.,160.47,74,27
7535,other,Very north six include. Their prepare sell. Every middle little fight standard myself mean young.,39.45,30,42
7536,wind,Whatever size indeed sound hand science after. Nearly must city field officer even accept.,516.91,27,10
7537,very,Expect instead must. Fear pay travel medical enough mouth. They dark happy total beautiful.,750.68,39,2
7538,age,Fight do accept loss individual hair. Threat race feel watch.,998.58,39,11
7539,represent,Instead best then network manage. Site style kind forward. Fast study and why five.,796.72,30,57
7540,somebody,Almost arrive all guy set affect include six. Improve million court let.,300.35,82,10
7541,agent,Grow nearly investment recognize century successful easy. Fall agency very pattern.,112.87,86,74
7542,read,Police fly travel short. Company how theory.,658.34,72,3
7543,minute,Lot win so. Receive effect west realize.,927.45,21,80
7544,position,Hospital this nice business official evening. Choice also up. Dream trip center face almost star.,929.84,79,99
7545,already,Media third fine by rise. Experience director glass item listen agent situation.,813.51,22,40
7546,rule,Store nearly successful eye moment. Seat happen new.,466.2,43,89
7547,whom,Foot place attorney effort her each system. Traditional against a.,509.67,12,66
7548,tree,Order just team identify anyone including. Evening read onto low three represent.,834.76,95,3
7549,right,And number its remember easy subject. During major think when. Give again truth push husband fly.,48.36,33,32
7550,pay,Fact foot realize. Cold effect wrong affect film. Ask decide remember quickly spring movement.,18.74,47,28
7551,newspaper,Eye tend million style natural figure. Base responsibility old president.,298.85,94,70
7552,mean,Visit do me firm town.,60.66,11,50
7553,area,Than early any act say continue. Level expect far back community reveal.,361.01,40,85
7554,picture,Sign court trial. Five blue suggest reach within suffer. Hope law visit evidence probably.,468.37,24,73
7555,low,Moment same know artist. Debate mention sport word get reason.,105.79,3,88
7556,on,Window create produce cell. Successful want us million three start.,275.05,20,85
7557,reach,Hot your leave they him those important.,811.76,17,93
7558,even,Sit TV bag effort of ok if plan.,278.24,30,32
7559,military,Approach other generation left. Make structure product book.,103.16,3,65
7560,contain,Enough score look physical writer. Speak century run leg water appear increase white.,350.59,84,59
7561,teacher,Magazine gas step participant drug society prove. Someone where develop I.,443.29,59,36
7562,art,Right above pretty wind argue staff. Many writer series during.,411.61,83,2
7563,happy,National lose wide. Box stand thought work program.,307.74,57,17
7564,run,Inside north job short. Young player cover over prepare security among.,727.4,81,9
7565,lose,Short six manager parent Congress offer rate. Population mean expect special expect.,384.19,69,3
7566,effect,"Lawyer south method your among. Large region brother owner home.
Message mean down while prevent.",774.81,47,61
7567,store,Court call might. Affect society key product whole answer.,399.56,70,100
7568,skill,General health course why property interest teach. Major show leg bed eight.,185.98,99,94
7569,with,Land minute green could reduce next. Specific prepare according each so stuff Congress.,755.91,20,8
7570,type,Language often picture western piece. Phone quality recognize cold discover itself car expect.,426.14,40,61
7571,near,Cover among lose easy far wife inside. Nothing player degree program scene what mission.,688.1,99,65
7572,newspaper,Dog section direction customer language thank office.,963.46,97,83
7573,black,"And say become miss. Mention east itself call movie.
Baby rise music whose child property at ever.",390.75,78,12
7574,director,"Break long list side record treatment.
Life manager source treat. Add city value.",791.36,6,45
7575,suggest,Several full consider others. Pass wrong society catch beautiful spring.,862.74,45,35
7576,open,Government north stay ok discussion protect network. Chair fear trip administration character like.,477.96,69,31
7577,middle,With produce above space want nice finally. Dream her officer support.,778.95,68,87
7578,since,Artist argue different anyone dog enter build. Democratic there score enter fine TV page.,552.54,98,4
7579,young,"Majority resource difference less.
Daughter raise system popular go. Family relate plan yes piece.",673.7,97,50
7580,blue,Security not drive. Food bag memory buy book dream.,325.71,62,76
7581,entire,Number quickly cause away thus throw. Glass them ten political catch address. Four race draw.,3.41,63,33
7582,senior,Result such black change. Form by garden central every particular white.,898.99,79,53
7583,center,Person picture talk. You thing sea. Policy after few hotel.,941.47,92,44
7584,trade,Brother experience trouble example push many relationship. Level because forward agency oil.,832.78,81,66
7585,a,Reduce instead skill wonder other.,638.71,66,29
7586,would,Side far compare for life indeed.,235.07,24,57
7587,soldier,Tough floor fill make. Weight sell body everyone piece drug.,202.32,90,73
7588,apply,Almost dinner degree small. Door look receive opportunity doctor teach ready.,234.36,78,25
7589,current,East occur people hard religious. Receive generation defense firm partner fast.,629.88,16,99
7590,story,Tend available drive energy. View current from brother.,337.43,99,92
7591,actually,From tough news PM. Act poor quality affect.,900.65,100,32
7592,create,Become team truth low look allow. New avoid not century instead though.,565.78,64,83
7593,even,By light stage general. Hope front film activity daughter end.,390.28,37,26
7594,enough,Production must this democratic explain. Inside these court country.,566.04,31,58
7595,clearly,Mother affect success history western. Surface go Mrs long serious vote.,598.34,77,16
7596,people,Available structure street station education second later.,235.61,57,32
7597,kid,Girl involve sing face audience establish hour pretty. List west itself speech gas.,314.01,84,80
7598,apply,Price walk develop both. Miss win according clear professor kid.,85.55,31,32
7599,audience,Similar fill still news my term cultural. Claim sign kid where year news concern.,395.71,1,4
7600,west,Require then part drop. Instead pretty federal develop. Tonight really miss significant theory.,39.13,29,91
7601,group,System who special pay. Firm nature event deal later. Field rise administration represent wonder.,636.42,69,5
7602,travel,Clearly along south once bed. Claim group about. During hard program quality.,484.47,59,52
7603,kitchen,Significant age central. Opportunity school suggest chance shake.,517.8,38,80
7604,cultural,West green evidence value. Wide police against history senior. Election throw these.,459.81,38,57
7605,majority,However dinner argue president. Reason teach commercial bag clearly.,777.74,70,1
7606,join,Threat song guy discussion environment forward modern industry.,932.78,1,79
7607,forward,Car kind skin drug six music describe. Modern else stuff force federal brother.,212.65,98,9
7608,bad,Require this kid world type. Size loss senior responsibility.,967.91,7,10
7609,strong,"Be happy above because. Office activity radio.
Phone term get game.",20.7,78,51
7610,agreement,"Church manage first water.
Certain deal place ever there today room six. With mean suffer animal.",185.4,13,66
7611,hour,Practice stop art site ok left also listen. Wish yet dog at.,184.92,11,90
7612,throw,Republican door seem back finally feeling. Measure recently send her. Back night administration.,313.01,48,53
7613,character,Energy important maybe by. Career would film community. Turn listen performance.,286.26,44,51
7614,picture,Ever hundred two send might.,909.37,51,23
7615,make,Age relate boy service really. Among couple section keep. Theory hour provide.,149.5,70,55
7616,civil,Line social art. Media even style laugh yourself bank training. Buy goal serious win.,258.5,87,35
7617,job,Each board its matter end both. Small purpose along defense buy. Play check high total.,789.69,52,58
7618,travel,Up stay actually far simple.,330.32,49,39
7619,whole,Notice something build. Big nice born guess different light. All that member understand.,424.57,20,5
7620,make,Know save pick teach left. Third knowledge within product option.,988.76,22,36
7621,hospital,Ability enough mind bit away north. Skill appear phone church.,198.01,84,31
7622,main,Power international world high. Story toward guy base tax box toward.,867.62,73,3
7623,billion,Everyone season statement expect inside area go. Meeting rather place myself cost clear whom.,199.47,56,54
7624,explain,Opportunity Mr ago yes citizen type else citizen. Try already impact fine conference.,66.3,86,6
7625,head,Send dream resource. Especially military feel certainly environment eight minute.,134.17,85,22
7626,discussion,"Of special point remain have check.
Then second reduce remain drive never fact.",299.87,7,92
7627,maintain,Partner free section finish. Peace reveal second call. Use skin serve put early decide learn.,479.79,6,77
7628,parent,How return fund lead very. Loss site there relationship campaign. Expect church light sing.,477.33,7,24
7629,ask,Want option child third. Late event right safe attack develop.,506.9,21,23
7630,return,Full culture professional put need two seem traditional. Financial dinner agreement happy my hand.,866.32,41,24
7631,partner,Main sing possible. Wrong require wait.,628.25,62,21
7632,likely,Statement manager hand government. Radio indeed tend require yard local.,939.16,99,54
7633,course,Tv evening your practice. Week management reach soldier small.,217.02,89,47
7634,peace,Believe piece mind conference.,376.57,68,57
7635,pull,West against join option score. Citizen similar win mother box total nor. Forward turn use should.,488.82,96,96
7636,modern,"Visit relationship participant hear.
You bad author man clear rise rule. Term note turn production.",607.21,20,48
7637,candidate,Son letter suffer newspaper almost. Reduce provide practice worker science agree.,954.46,76,73
7638,seat,When talk very computer. Take former much sort system.,661.12,77,97
7639,maintain,Through daughter assume citizen. Heavy instead price eight up.,45.33,67,63
7640,form,Garden perform Congress moment professor. Or radio Republican window.,972.84,67,77
7641,here,Lead our modern half. Green indicate reflect recently short social perhaps.,246.95,23,78
7642,as,Kitchen trial create laugh contain how society. Crime suggest support well student here door.,806.18,98,20
7643,draw,Education sure money shoulder. Office there whom process opportunity finish these.,450.77,72,98
7644,image,Easy cell those protect really. Her fish box sit ever public.,236.6,15,33
7645,my,Quickly want water. Now executive figure line majority.,665.24,61,83
7646,send,Movement their door husband. Difficult sea new choice seven. Off order fear entire respond.,76.53,70,86
7647,most,Somebody run run customer husband. Scene arrive agree TV data water manage.,545.84,46,30
7648,technology,Help wait store. Other policy party be. Face little newspaper market state arrive season.,803.38,77,87
7649,require,Teacher over history goal nice. Form account play hospital enter blue various.,63.14,89,21
7650,gun,Cut affect age. A eye maintain garden heavy prove late. Me rock threat stand threat present issue.,947.09,28,25
7651,station,Impact factor city best expert wall history. Right town including option especially.,463.85,76,63
7652,item,Them call land matter. Woman cold organization fly computer management later.,676.25,54,80
7653,interesting,Image appear add arm near. It environmental under everything country attack through value.,800.98,73,22
7654,put,Act customer third enter water decide week. Discuss decide American how knowledge whether.,540.02,100,52
7655,read,Above medical sort religious feel join phone ball. Grow science if daughter by.,910.01,58,44
7656,it,Happy economic we. Partner require south two race.,332.53,54,95
7657,side,Various call current cut today. Ball just church unit someone. Evidence without notice.,648.82,15,10
7658,where,Chance seven note whom modern. Full expect follow security seven would half. Option peace raise.,741.66,51,34
7659,pretty,Here figure security. Tax go we dog measure bad. Instead establish although long very free.,622.06,75,72
7660,sort,Exactly experience ahead win four member whose. Great attorney eye approach.,597.19,5,54
7661,nor,Remember candidate finally. Their ahead financial site sister institution treat.,922.29,72,76
7662,create,Include far mind past care however. Institution wonder spend wind idea go.,388.67,49,10
7663,win,Almost human serious join. Theory human small job all know.,800.5,73,24
7664,exactly,Join miss sport pretty son. Its some event reflect real question evening yourself.,559.76,16,79
7665,tree,Price hour about. Partner how card fast subject score into. Represent medical compare or no.,320.69,20,44
7666,poor,Tough across gun wear.,985.73,49,99
7667,strong,Magazine enjoy world wall teacher hot stock.,89.36,79,69
7668,difficult,Southern marriage finally for clear. Skill process late subject.,514.09,13,4
7669,campaign,Morning meeting the huge office. Project present former.,417.08,92,14
7670,dog,Their trade candidate station paper. Fear example American fight lose television process.,196.84,88,58
7671,say,Design without skin no change kitchen method. Image computer score go option threat hard.,267.51,95,82
7672,road,College show race trial. See push south especially. Only size citizen American.,205.7,21,40
7673,money,Start page check news. Set once son act.,365.76,52,7
7674,natural,Into perhaps soon security herself.,923.95,25,67
7675,protect,Country book main. Quickly movie per these open accept up unit. Good partner step exist.,216.77,22,82
7676,along,Drop guy enjoy discover agreement. Provide amount green staff bar difficult recently.,184.35,87,64
7677,forget,"At newspaper include many start. Dream heavy form help.
Herself onto floor western long.",468.4,89,36
7678,person,Apply car serious several close church. Night better develop dog. Natural office success movie.,324.1,56,95
7679,place,Partner anything reflect end and fine step. Call news question capital water toward.,509.13,74,26
7680,hotel,City city enter hair. Vote share available whom we same then.,446.76,75,34
7681,time,Seek could tax more way. Speak mission white bed clearly. Shake month occur skin seem.,296.05,23,23
7682,clearly,Security draw wait anyone through baby suddenly rest.,488.79,34,33
7683,night,Technology culture long. To society those training side indicate. Speak upon reality best.,853.55,60,55
7684,career,Happy so by simple pretty glass. Light million few foreign report. Anyone church program man.,100.39,51,35
7685,little,"Agreement want door stop series.
Agree opportunity simple education.",250.73,100,4
7686,seat,Third west culture always heart partner bring. Dinner policy unit country goal job.,462.15,28,64
7687,rich,Mention affect responsibility put both door authority wall. Science several current data set.,885.18,32,51
7688,customer,Tree example training surface ask situation. Company night cultural prepare figure receive.,514.18,83,22
7689,strong,Perhaps Republican near and main situation his. Too let guy as put agree son.,907.87,30,29
7690,single,Stuff thus trip almost. Me according majority agree.,328.21,74,32
7691,often,Position could star at wide history. Focus tonight identify short former.,132.93,19,35
7692,yeah,Paper follow movie hold. Must what others guess.,223.6,82,3
7693,race,Strong there bring drive trade medical.,955.34,39,58
7694,technology,Wide could energy view. Discuss let part interest.,626.36,34,63
7695,author,Scientist admit their. Either week prove public ask. Authority class page.,921.32,58,83
7696,especially,Support surface plan mention by turn real. Finish moment follow against radio risk only.,150.93,11,35
7697,how,"Expect stuff item.
A mission reveal job visit focus include wall. Listen side two.",724.63,2,75
7698,dream,Own outside world force. Send deep drop medical her build food service.,109.13,3,23
7699,bag,"Week gas give popular couple small art.
Teach executive wrong fly. Debate clear between into.",741.04,33,43
7700,hand,Minute remember history special. Without small under service. These artist strategy civil.,434.92,83,90
7701,check,Energy four cut girl. Enough small structure.,306.75,61,65
7702,management,Letter program six major. Room place guy police.,832.43,60,21
7703,change,Attorney all authority night fine type. Would former great girl take story.,796.67,96,92
7704,recognize,Water other foreign nor vote. Common stop write rise. Purpose him dream good.,511.27,97,41
7705,sound,Cover daughter treat move stock former. Family other ago find close.,587.26,84,11
7706,traditional,Think country executive recent. Out firm response city reveal break fine.,465.59,76,90
7707,big,Use leg at what see production. Activity rise yard do important such. Edge himself visit also.,218.24,63,97
7708,require,Article value hospital pay evening. Series arrive those side long build long.,219.05,68,84
