ProductID,Name,Description,Price,StockQuantity,CategoryID
1,reality,Fine market admit. Account concern respond never. Seven million power crime gun recognize black.,440.86,10,90
2,police,"Simply him arrive industry.
Particular especially nature case.",120.93,97,77
3,fish,List year director kid. Deal evening I. Because condition democratic brother specific performance.,831.56,67,45
4,someone,Close population grow thought here his. Produce drug cause admit suddenly.,877.77,48,92
5,service,Result customer each democratic there some. Effect total purpose anyone science dark.,118.79,56,68
6,mention,He security follow. Do value director claim PM chance. Away vote try large beat fund.,862.21,25,99
7,source,Visit when new kind bed. More couple development your go effect.,999.69,53,70
8,during,Half class scene yet maybe section. Knowledge myself pattern apply magazine author.,126.57,47,45
9,film,Significant pressure official hotel. Least speak play full million prevent.,172.87,36,64
10,billion,Would with do image.,88.38,100,98
11,development,Order he less keep. Apply consumer security visit always mission.,711.48,4,36
12,training,Opportunity campaign course need keep. Discussion important bill subject.,784.51,67,17
13,far,Between position art too.,159.25,15,64
14,husband,Explain charge order buy personal. Goal style happen wear day.,45.29,29,80
15,more,Develop understand gun goal. Mrs main win candidate beyond.,892.81,38,51
16,water,Purpose significant likely at medical lay. Become behind hundred director scene better knowledge.,694.13,10,51
17,enjoy,Cold free thank better. Memory cover road. Yet itself strategy best tax since.,624.06,58,56
18,number,Type glass community near. Authority current every couple yes.,549.67,8,100
19,thus,Century within current help result break have. Break something surface magazine travel never event.,585.39,48,33
20,by,Nature himself care always down thus.,250.16,94,83
21,measure,Go Mrs argue identify. Loss yard stuff church term shake.,91.36,0,74
22,lawyer,Of want issue Democrat onto. Group from feel party total cover space.,205.94,21,20
23,before,Upon job investment economy interview. Stage usually between officer husband investment growth by.,640.92,52,84
24,we,Front third use believe by. Down and structure language book third always.,821.24,19,28
25,stay,Girl cost like voice. Whom might support action meet because today.,924.54,52,42
26,different,Property cell drive late explain daughter. Anything stand event election parent themselves.,992.57,48,96
27,ready,Nearly know see vote daughter give. Pm court affect so.,290.44,98,83
28,hope,Want shoulder since as feeling light. Phone little book mind training rather.,479.18,93,72
29,drop,Center argue quickly shoulder maybe. Unit spring organization field indeed far history alone.,473.23,96,3
30,street,Writer mission writer want difference seat key. Begin throughout gas least quickly well.,131.37,85,23
31,mention,Believe hair deep. Yet why clearly per. Foreign hand game such.,187.87,90,95
32,kid,Deep write fear in.,980.8,30,30
33,yeah,Line plant out speak. Police I once better machine customer interview.,919.5,40,30
34,accept,Positive thus risk eat red floor different. Word commercial thank recent least trip stand.,668.01,8,78
35,red,Lot writer performance kid fish painting. Push fear bill cell.,614.95,69,4
36,quite,Region always into financial stand free front.,262.81,13,42
37,every,Husband activity cultural American local. Thought prevent least performance star.,635.81,59,96
38,most,Little word inside seem analysis safe bad. Here Congress since go table history former small.,203.54,56,15
39,music,Little continue maybe author team. Lay set travel population.,578.35,98,44
40,American,Better ago involve cost line here. Wide seven use. Price laugh become.,476.07,51,82
41,show,Charge night knowledge. Public focus join price much discussion affect. Former into TV.,150.14,12,12
42,during,Light son purpose grow source father along.,667.76,11,22
43,worry,System build pass near Democrat level since. Case describe loss purpose floor.,800.18,70,61
44,career,Use memory not. Last clearly that. Generation toward form enjoy wife shake.,415.88,57,84
45,which,Thing operation magazine indicate policy after. Discussion almost short forward computer.,706.6,17,41
46,letter,Rate major prepare which. Prepare throughout either present ability possible dream.,4.24,24,99
47,ago,Avoid contain ten line minute serve. Major our know push. Detail thank condition reduce shoulder.,442.13,54,39
48,future,Between serious per me life half operation suddenly. Face thank question smile mind interest.,16.83,67,99
49,himself,Side give animal toward. Sea possible sell.,362.16,32,51
50,guess,Best agency series future water read himself. All present crime. Truth artist partner form.,591.73,70,16
51,animal,Exist say weight nothing recognize. Focus rate animal own future arm. Better star build management.,743.18,46,74
52,degree,Participant new language. List thousand anyone five run modern run. Picture force million.,742.28,1,65
53,news,Toward million sit. Interesting next recently our visit mother itself.,21.88,57,69
54,court,Top opportunity forward age talk. Ever without evidence Mr last senior.,653.56,4,90
55,strategy,Figure federal there bag six themselves purpose. Service show he tree.,949.93,34,65
56,model,Too international although information receive. Name in your power some natural.,183.32,7,76
57,international,Crime quickly way onto. Season minute should with.,68.88,77,43
58,year,Real present such include. Rise response well focus usually TV inside.,78.92,94,73
59,relationship,"Number or hit. Respond amount back image follow.
View doctor once decide cover indeed ahead.",675.92,67,19
60,nature,On notice deep which second. Form phone team foreign seek.,380.57,4,44
61,church,Carry create son buy low fill decision. Community nation plan. Adult standard campaign call.,358.8,93,32
62,many,Challenge moment better remember imagine.,89.98,50,73
63,take,Result include black show from.,740.39,75,35
64,forward,The guess hotel opportunity. It range part boy ago defense ten.,580.69,73,4
65,put,Whom federal life heavy might. Wife partner hot here capital employee. Police card agent method.,54.94,5,67
66,might,Professor always along article. Little buy message series often dream. Born or not generation.,566.12,66,5
67,language,Alone fly less think boy defense. Maybe chair arrive sound. Pm big town range whatever.,940.58,5,84
68,result,Thank try human fall. Mrs bad tough TV. On civil that north nice technology western.,310.23,66,98
69,white,Short human town. Success board tree purpose alone rather allow appear.,470.25,92,64
70,produce,Assume democratic issue five generation. Hot forget recognize.,799.87,87,22
71,natural,With agree industry much tonight.,162.91,69,54
72,family,Wear similar or. Mention group save girl station each.,496.78,87,73
73,standard,Out mother event today ball war. Positive property scientist.,271.67,59,47
74,garden,Thought very analysis first as range. Hard yourself reveal often morning floor hear.,604.25,83,44
75,oil,Police cause sound just half. Investment director ahead shoulder company record education.,762.32,31,61
76,result,Than which use. See even someone hope discover history important.,92.49,72,59
77,easy,Skin become child part. Well quality represent assume four PM peace.,878.69,11,21
78,return,Threat region statement evidence fight. Never attention again budget leg oil on.,543.41,72,94
79,final,Finally sing wind next hear real special. Degree must though fact purpose court high.,502.13,37,33
80,under,Time party hour contain leg effect discussion. Say position commercial financial no unit.,844.16,57,38
81,daughter,Art memory seat adult staff recognize fund.,181.82,13,52
82,fund,First fire leg watch various. Civil meet town. Way enter enough action late miss family.,305.26,60,41
83,beyond,Nor treatment cup similar case garden. Government bag Republican everybody sea factor.,269.0,89,67
84,top,Return ago wide seat politics up brother. Speak financial just edge message herself executive.,384.4,51,6
85,day,Little subject middle look traditional include. Standard think focus important.,283.7,11,29
86,business,Certain detail message see chair school player space. Character gun treat thousand agency.,965.32,44,10
87,within,Effort man government reach food million project list.,430.97,77,2
88,suggest,Very TV sport energy. Address region although fine watch. Result quality hot mind drug clearly.,56.47,61,69
89,benefit,Page fine now then. But group forward enter owner company approach.,441.52,84,13
90,newspaper,Consumer position stuff girl nation loss it.,253.92,43,84
91,leg,At cover maybe look him. Detail nor talk bar.,357.96,37,93
92,across,Attack similar employee station paper. Pretty never to item with.,270.95,61,22
93,through,Material thing class. Sea agree early.,921.93,51,78
94,cultural,Every take religious program story. Recently even high increase prove.,501.39,96,24
95,center,Gas explain gas community fine. Suddenly budget room through hospital.,958.0,81,40
96,story,Drive term sometimes identify. Physical food same which commercial hand no.,734.25,70,5
97,pass,Discussion social bag us participant plant.,825.34,1,42
98,kind,College democratic after produce. Usually rock account organization party television.,700.51,59,53
99,read,"Whose design impact lot.
Mr conference successful. Up pattern evening TV property show.",262.47,24,27
100,high,Catch cost hit.,620.45,47,84
101,low,Same yes condition they scientist leader. Most answer car build task truth move.,753.16,32,37
102,keep,Subject point study may rule return environmental. Other address drop. Catch ever building body.,665.2,72,46
103,age,Common base gas TV over. Your lose different discussion.,84.11,32,81
104,finish,Feel as nation mother world fear the. Just agree agent economy.,162.19,51,84
105,true,Subject never speech civil it. Floor over listen. Include store why.,581.26,40,99
106,organization,Decade soon but. Range on finally real too human most. Her her bill back hour.,579.68,25,29
107,reach,Century whom international. Somebody process market on.,776.14,10,28
108,provide,Step truth finish.,683.84,12,84
109,chance,Determine plan instead political. Past get do way drug. Blue guy program TV run.,731.1,29,97
110,whether,Much within ball interest type clearly. So yeah still happy right home I.,902.37,39,99
111,each,Class two cup course. Difficult society should away performance role.,760.84,63,46
112,happen,Hand occur teacher human thank modern wear. Decision assume fight degree sure.,175.65,66,76
113,pretty,Draw understand meeting stock. Development animal lawyer special. Far fine foot image.,804.04,11,45
114,throughout,Throughout against friend color whom because else.,246.34,31,36
115,health,Design arm reduce forward include hand. Use foot crime race win yard.,986.6,78,76
116,prepare,Suggest green south list. Much wait assume actually.,149.15,56,52
117,thousand,Direction case too perhaps wish store song. Behavior exist another late choose brother.,913.06,15,56
118,hope,Note under color enter. Maybe main give land few. Establish news reveal American because over.,101.03,45,6
119,while,Bad when strategy person bill teach they. Better building him sing likely seat play other.,942.4,93,83
120,couple,Way few suddenly investment fast Democrat six. Social writer attack concern take.,665.46,15,72
121,dark,"Politics become claim data water.
Run man yard forget either. Decide view free other better him on.",559.15,2,56
122,sometimes,Simple college bag. Probably second PM describe.,291.78,94,15
123,argue,Compare your finally box court security action. Teacher city turn various fine.,127.29,10,43
124,build,Character door maybe fire majority ball machine. Adult rate believe of keep grow.,990.46,75,17
125,collection,Instead simply ask exist glass behavior.,653.38,12,50
126,age,Similar win many prepare arm. Natural although lot art couple.,424.1,1,6
127,degree,Effort age treatment. Realize care idea gas surface factor perhaps. Final try lead indicate stage.,582.51,56,38
128,look,Election skin nice water. Money kitchen sell center.,382.38,31,92
129,remain,Chair resource possible your want training guess. Short prove or notice.,870.45,31,9
130,enter,"Production first father address. Exist floor interest senior security phone.
Music save movie.",590.72,47,23
131,former,Read order meeting. Building base field marriage power.,835.29,38,58
132,today,Reduce figure much quite least.,552.16,73,21
133,talk,Small deep each exist traditional. Side such hard relate yard. Dark ready upon morning check.,581.13,54,18
134,including,Others standard glass century activity. Their enjoy method.,768.19,57,20
135,operation,Western often lawyer your range article.,741.77,19,6
136,project,Discover relate class reflect what word page. Itself might site street the decade value official.,690.53,81,46
137,police,Any white once democratic. Although language young reflect with business southern.,847.43,9,75
138,institution,Network ask nature guy wait under large. Accept husband situation energy.,900.17,31,62
139,exactly,Put above unit discover quickly figure. Follow computer laugh southern building idea agency.,166.7,73,63
140,nice,Give natural adult mention hair yeah. Discover alone left probably himself cost which population.,947.04,38,52
141,however,Something exactly phone. Protect think deal first side as. Follow tell common end power community.,810.89,21,30
142,first,Fine move international attack book.,759.57,91,72
143,growth,Three point former personal. Work full interview control indeed.,272.13,41,33
144,may,Real study minute bed cup trip simple reveal. Ground could defense occur bank.,568.68,58,15
145,value,Government offer mouth. Consider woman middle movement.,374.27,75,100
146,raise,"Whether important kid left. Fish form later author.
As or hot. Feeling again total life.",496.97,8,75
147,particularly,Resource site certain some. Computer question drive travel market.,978.22,87,69
148,small,Find require each. Again manage political develop. Forward coach necessary yard drop.,87.72,41,76
149,when,White bar above. Write rate focus realize gun necessary hit major.,930.82,39,56
150,help,Report world up every watch very actually. Turn wind land.,988.98,1,67
151,cell,Particular send game near fund or debate. Audience include live from arm.,208.39,31,15
152,stop,Artist your but guess nation. That trial man consumer out less.,356.96,63,78
153,magazine,Structure wall add. Magazine degree population after.,132.78,40,60
154,eight,Direction improve with whole. Make box win some. Even head through meet above their.,587.72,40,100
155,market,Prepare hold play heavy.,826.39,13,37
156,PM,Radio study so allow huge. Light gas computer reason none without.,710.0,58,26
157,operation,Place school would. Recently firm whole specific public past.,500.69,77,36
158,professor,Human student factor form office nice. Rich light compare side skill history moment.,720.33,58,46
159,there,"Or best year them.
All even she agree spend. Accept their everyone if despite.",879.82,100,40
160,main,Economic say suffer right. Many unit movement. Price skin cause deal.,929.62,32,75
161,democratic,Purpose matter very light standard. Point thought wait president task trip school little.,356.4,49,82
162,issue,History wish writer quality. Unit property should much. Two coach change they news feeling.,945.91,24,86
163,now,Decade act beat. Week evidence lead real affect mission reach guy.,626.57,94,87
164,water,Itself modern recognize him attention. Whatever discuss until.,821.38,28,28
165,field,Reveal garden exist. Situation though population beyond effort employee.,869.53,20,55
166,edge,Relate dream avoid try. Save opportunity person common reduce. Vote my send continue later.,985.59,75,62
167,rather,"Cost with vote within fund main.
Hit this boy me dark amount state bag. Nice treatment that man.",170.39,35,5
168,church,Enter stand consumer low court eye. Party talk responsibility.,852.81,46,95
169,sometimes,Such recently almost citizen sing. Rise whatever camera where worry cause this box.,312.96,76,1
170,will,Television goal effort senior. Five cover expert somebody performance radio.,3.16,99,89
171,form,Center physical against why surface money. Society recognize may set want.,391.08,50,53
172,note,Surface box economy write. Goal author individual beautiful catch few step.,481.36,49,70
173,probably,Answer risk game. Bill everything interview film trade point.,653.84,77,7
174,start,Race from participant bag on.,624.93,65,60
175,bring,Foreign turn price while. Last offer food number shake interest.,327.41,49,66
176,grow,Success population that step enter. Picture buy view heart ground whole pull.,68.82,14,24
177,explain,Front trial religious history.,227.04,41,48
178,rate,Data rest think adult author painting. Else mission business usually.,699.48,64,75
179,issue,Radio majority partner simple. Defense energy day run want kitchen across.,516.72,18,72
180,first,Week look tell few understand. Certainly design nice deal. Structure quality industry.,307.33,62,29
181,alone,Economic national others majority. Them affect despite bar. Kind agreement old food bring well.,237.38,17,88
182,already,Market almost same occur military majority want while. Half pattern girl want across specific hair.,305.52,15,43
183,feeling,Mother college camera five test. Physical rise court idea deal behavior.,824.64,24,9
184,fight,Natural contain how hair. Figure something the support now century.,213.5,85,56
185,per,Factor performance attack country. Well sit give long view. Drug range commercial model try such.,106.64,56,53
186,charge,Fight identify then bring. Officer cover reduce garden hour.,115.17,32,33
187,three,After how according girl very anything lawyer. Language cold statement shake school child.,100.51,77,63
188,ability,Camera also measure side nearly just. Approach well contain college happen cell.,512.09,38,41
189,several,Themselves board spring instead art evening end particular.,442.14,74,36
190,quickly,Sort news should voice behavior. Stay help yet room man. World citizen only play town meeting find.,39.88,68,2
191,on,Central subject range law power. Media PM event wide. This protect service.,962.75,91,94
192,bag,Hold care series strategy allow. Old seat fish fly.,41.07,27,87
193,today,Detail Democrat race whether safe bank hospital. Probably few conference meet.,730.37,76,79
194,room,Station deal building hair eat. Tree research heavy rest beautiful window.,668.92,63,5
195,vote,Work power method item positive reach. While knowledge discover unit girl figure song.,530.86,80,1
196,wear,Many major catch society so machine situation big.,203.8,4,59
197,yard,Head fall commercial according black water. Social direction blood.,505.5,65,32
198,college,So assume involve parent. Speak check sort close. Past although great air fall yourself middle.,730.25,59,29
199,your,Direction real picture. List so miss next view series.,210.76,34,77
200,it,Little individual let. New center think note lot son inside.,138.73,99,27
201,expert,Degree respond here they.,458.51,16,6
202,computer,Someone skill several drop window door. Five room someone read six.,216.17,81,19
203,but,Research dark stay thought big adult. Position factor road unit.,235.82,8,65
204,hit,"Hard goal answer in.
Usually need her thank. Whole son that career off appear speech.",698.72,80,2
205,culture,Ok add too family trial culture. Give news walk. Why nice admit however central.,325.67,29,72
206,choose,Student style history.,95.34,64,39
207,admit,A language agree recent myself.,85.29,22,64
208,heart,Across avoid cut character they campaign price. Establish similar personal.,347.93,76,10
209,region,Choice continue region operation response staff. Recent next majority song prove stage friend.,800.87,61,52
210,interesting,Rest piece relate what heart clearly. Door certain number size investment rest across color.,742.21,80,64
211,drive,Yard page age a yeah consider. Day shoulder evidence head.,915.4,97,10
212,important,At marriage control operation effect set avoid though. Career ago land whose.,577.52,54,95
213,offer,Black join turn as bag player.,380.01,70,67
214,family,Lawyer kitchen church management hundred total. Sport participant government necessary.,357.06,17,52
215,generation,We rate meeting type. Wish road fact box visit. Over manager thus four would.,388.08,21,100
216,movie,Speech current fast short realize. Partner bit education learn. Ability likely interest different.,627.91,0,17
217,value,Hair half white quite become. Mother become forward end anyone. Whom behind big name street.,641.71,40,47
218,deal,To school develop candidate add class. Item medical catch life choose.,279.08,80,88
219,risk,Strategy speak plant a. All major option happen let north.,688.72,10,89
220,writer,Onto clearly message actually want. Marriage guy yes night hundred.,908.41,23,33
221,I,Old knowledge image personal according bad relate. Act value must free career growth.,419.47,84,32
222,include,Tell scientist former. Drive nature production finally later.,402.71,4,77
223,whole,Tree road debate return offer glass dream. Necessary Mrs which scene themselves.,767.52,35,19
224,suddenly,Team thought any mouth perhaps western. Detail school program.,124.22,90,85
225,seven,Hotel of turn. Change decide draw society draw land. Door show per could front strong really.,351.48,41,9
226,huge,Own serious certain form agent. Design listen reveal everyone activity.,519.8,40,86
227,career,Human authority set floor here building case play. Threat stand behind cold hard finally far.,838.62,69,26
228,industry,Lay Republican art change natural. Hope glass effort five your one Mr.,465.84,2,27
229,attorney,Able artist story affect. Environment student ahead. Production enough religious improve.,518.11,24,21
230,so,Something more drop consumer realize officer.,551.76,97,8
231,play,Kid political as dark night leave hear ready. Box key hear while.,791.33,92,45
232,act,Then perform large list left market model owner. Include attention more seek total time radio.,405.26,91,55
233,husband,Country poor challenge wife. Determine analysis quality kid plan.,184.96,62,10
234,benefit,Scientist often herself force. Anyone democratic late entire certain.,991.25,86,57
235,peace,Fast why woman important. Financial glass team with nothing. Knowledge edge total just.,981.28,86,35
236,check,Off possible will they service over professor. Author after cut news hair reality check.,40.29,40,60
237,nice,Walk road marriage individual. Million which director. Parent talk issue although risk.,33.04,53,97
238,born,Issue soon nice enter open truth.,85.91,81,42
239,through,Society message who pass onto. President police simple money. Ago really develop join capital.,768.31,48,62
240,protect,Natural together shoulder subject state where. Relate control would.,692.98,99,26
241,poor,Product form sing exist home include skin be. Visit order accept argue culture country.,322.37,85,7
242,TV,Box statement amount out agree away baby. Teacher those analysis best easy message civil.,422.02,52,16
243,agent,North it I wear into visit stuff writer. Few point person clear house. Involve property during job.,316.22,14,30
244,audience,Back attention continue century nation join. Assume trial especially employee worry.,68.56,76,18
245,business,Should author man hospital. Through small collection.,637.28,82,29
246,federal,Radio in science staff cold. Choice material still government visit certain.,588.28,77,63
247,federal,"Heavy whose west. Center wind act fear do the.
Be pull career recognize serve pressure quality.",354.35,62,87
248,draw,Dark especially decide knowledge. Dark allow seven night democratic minute maintain suffer.,767.48,49,41
249,just,By machine on. Professor according meeting note shoulder suddenly sport. Pass view the local also.,452.34,58,42
250,court,Four note series magazine. Know though indeed director such develop feeling.,454.09,78,8
251,all,Worry without decision nice. Skin gas church fall total. Back lose side kind ground.,565.31,6,16
252,ten,During read she forget really play. Hour alone notice reason administration age.,64.78,48,28
253,year,Certainly past page talk. Trip important want provide.,531.18,65,35
254,material,Task line by brother high subject goal. Morning animal protect truth must evidence.,403.02,98,37
255,those,Open politics offer trip change finish capital. Toward task improve.,792.44,53,63
256,just,Guess why general back. Everybody color sing hand.,672.69,44,85
257,ten,Process feel million debate field they everyone send. Might cost few ball scene worker.,224.94,58,100
258,test,Our threat class crime. Live democratic management per. Exist fall range.,182.18,40,13
259,light,Water year speech my each food task. Seek though chair from by.,932.11,53,71
260,away,South maybe question actually industry specific question. End check every worker particular.,251.67,6,37
261,nearly,Quite despite bring of room. Democratic away nor threat.,780.4,89,45
262,similar,Strategy even sense physical upon. Series sort part author friend summer include money.,232.79,87,28
263,particular,Economy last left report town. Girl quite know section cover cause area gas.,261.94,65,29
264,sister,Range today set carry successful people.,890.07,72,71
265,issue,Government small now without join. Vote evidence eight someone organization their.,322.86,70,73
266,receive,Expert positive administration system possible respond. Political worry manage Mr scientist your.,40.48,91,16
267,talk,High pull civil imagine purpose sound. Consider spend describe grow. Mrs arm set senior.,788.05,43,61
268,relationship,Street spring relationship herself. Mention today person this family sing day.,906.02,43,32
269,believe,Writer describe age guy also of. Meet success student occur.,168.23,59,27
270,close,Often environment left every building cold. Kid production politics catch red red.,988.63,45,81
