ProductID,Name,Description,Price,StockQuantity,CategoryID
2397,stage,Near first maintain while value knowledge create. Watch two happy maybe.,102.3,28,62
2398,father,Mother picture change. Computer small property success school administration less.,532.65,83,88
2399,if,Benefit address really support write big conference. Read market hotel.,91.12,83,93
2400,short,Decide offer Congress authority religious main. Especially likely month make.,182.48,0,69
2401,public,Work identify already quite go. Him war sometimes first example security.,523.77,28,74
2402,enjoy,Second personal rather stop. Thank establish who would many.,170.92,83,69
2403,development,Next focus also stock become study government. Population agent state phone eat vote.,105.18,42,35
2404,school,Throw thousand land look. Make authority member let data science.,420.45,14,22
2405,skill,Seat interesting kid him cold dream. Will carry already process everything how all.,823.39,82,99
2406,apply,Much wife play describe base old. Picture white across old serve pick mission happy.,220.42,35,52
2407,article,Pressure tonight smile executive. Kind series ago tonight season admit as fund.,991.52,22,99
2408,better,Space against story. Road piece ground dark fund television. Blue reduce animal Republican bank.,789.49,77,65
2409,blue,Future Mr discuss piece. Establish maybe want three computer.,500.39,23,21
2410,participant,Piece performance keep situation despite recently Republican.,302.48,2,97
2411,enjoy,Two thus lead town. Art soon go.,234.01,89,92
2412,simply,Part top way eat. Up somebody certainly.,986.37,58,95
2413,door,Ready purpose pretty. Spend machine training detail last bit.,778.01,65,1
2414,cultural,Become traditional seem. Government several around new peace others increase.,48.5,54,20
2415,itself,Body with shake. Loss east food increase I age writer.,116.27,32,34
2416,candidate,Wife method maybe. Data week boy analysis. Tend accept mission receive soon whether respond.,811.28,66,58
2417,use,Hope eight deal because model could. Visit so like. Among week score onto mean method actually.,253.89,21,92
2418,determine,People heavy economy third.,561.39,67,57
2419,science,Research fish describe. Purpose that however trial tonight.,948.93,24,97
2420,environment,Nature necessary film direction. Area structure world social instead for. Good rate prepare do.,467.76,59,61
2421,first,Second factor this political. Plant become yes purpose.,434.19,48,10
2422,decide,Green want morning establish guess. Miss it successful number door.,261.19,15,49
2423,particularly,And morning treatment mention much seven. So brother picture sound community million source.,312.51,10,53
2424,bag,Training second see travel likely leg. Moment beyond system wear along.,840.42,80,87
2425,lot,What player people everything bank born.,404.48,63,67
2426,line,Serious single deep Mrs human. Own senior cause ready. Activity skin now enter.,142.56,10,13
2427,right,Heart discussion pick southern eight expert break. Program themselves deep story team us.,788.15,55,59
2428,often,His too section others because improve activity. Case can three low.,492.12,45,49
2429,son,Common the soon or follow decade four. Street spend feel leg son couple view.,701.48,66,46
2430,year,Wear mouth today cut focus. Room today painting development seem hold particular.,749.38,77,59
2431,ten,Participant system no appear hear manager. Lead return onto painting.,355.38,76,15
2432,any,Few level pattern few. Attorney power player. Impact month tonight meeting.,278.22,21,12
2433,especially,Might be condition commercial. Fact free somebody must something activity teacher.,820.4,55,43
2434,shake,Us new throughout Mrs professional good notice. Southern color while research.,870.55,19,71
2435,physical,Soon amount near early. Claim learn brother case good include think.,502.42,7,2
2436,bad,Require head particular involve talk avoid. Market week and data region put chair understand.,875.55,24,79
2437,her,Fight theory agent federal. Reflect owner health soldier long. Manager coach decade appear.,372.47,38,86
2438,agent,Personal age difficult heavy white. Purpose range appear camera individual design special should.,769.2,88,73
2439,development,Information smile night. Enjoy however inside power.,105.99,92,91
2440,ask,Several decide include factor produce threat. Late life medical some billion sure.,196.49,30,5
2441,structure,Accept ever popular few bag than week marriage. Against set brother.,784.69,20,26
2442,those,Agency stay reveal page way degree. Site available which itself. Bed raise accept all.,217.4,32,60
2443,statement,Seat himself safe investment already.,292.95,27,50
2444,traditional,This side role plant store wear star. Goal ever do light commercial moment. Start parent bad watch.,609.04,37,15
2445,during,Study sure her both agency course need. Both research pressure participant wear.,778.2,9,86
2446,whole,Important decide think no degree student what. Produce so role thus get play as.,463.52,55,99
2447,north,Phone street unit worry civil now much. Street and subject store say speech fall pick.,902.7,93,69
2448,now,Exactly guy anything through. Anyone more stock accept success.,910.37,83,65
2449,billion,Amount level century need middle. Too several director score.,240.32,26,38
2450,so,Send work could product middle reflect quite. Provide station guy market color song western.,823.36,6,10
2451,fine,Day if five. Public marriage wind run stock protect. Practice personal especially election radio.,440.0,48,83
2452,agency,Lawyer direction glass meet finally model quite staff.,346.13,94,94
2453,work,Analysis we information sure series some. Night me great building.,822.71,30,35
2454,wall,Media camera last someone central real catch. Defense quickly size.,303.59,14,91
2455,shake,Few point stuff subject statement summer sense.,580.59,96,53
2456,dog,Over us open Republican she. Arm performance might team situation pass.,472.99,32,66
2457,not,"Purpose would force.
Choose prevent again he. Side education one loss.",496.07,45,10
2458,before,Land model room resource laugh every.,276.08,11,45
2459,test,"A camera star safe. Guess she available coach activity win.
List water know stop.",40.55,96,24
2460,political,Sing perform against morning break. Site seat fight pick be whether image story.,313.29,61,27
2461,word,Model movement town product able kitchen deep. During some one near reveal race.,431.99,82,79
2462,account,One price blood manager something. High majority seven water whose. State along ready guy.,991.11,25,34
2463,social,Practice box economic shoulder. So anything show amount option nor call.,288.67,37,40
2464,purpose,Notice onto close condition for another act. Allow good maintain threat require talk from.,786.23,86,2
2465,large,"Member ago common human whom.
Learn if recently me turn.",7.95,79,41
2466,television,Ok baby learn idea similar energy behind. However main Mrs difficult cover.,4.32,93,10
2467,what,Cold decade government so check. Can size the between figure environment certain.,293.85,61,74
2468,much,Machine turn respond onto able begin consumer.,531.81,45,10
2469,address,Third upon over probably. Painting pull read fast management operation responsibility specific.,216.81,62,89
2470,back,Owner newspaper clear exist rather drug. Crime government health his daughter.,451.42,53,70
2471,onto,Especially radio group imagine easy law.,900.22,95,100
2472,eat,Wonder how majority five woman television. Admit five us in sort outside.,165.87,35,15
2473,party,Could camera few. Nearly large remember music medical yes admit.,691.23,76,85
2474,put,It like and vote customer mother. Mrs situation fish type degree defense.,186.05,76,51
2475,outside,Well agreement behavior color. Him purpose born beyond generation.,498.71,60,78
2476,another,Movie day commercial music quality play deep. Over language shoulder data central animal.,131.52,67,55
2477,society,Sense nothing else.,783.35,81,54
2478,our,Under represent tree more generation happen beat. Can Congress energy city natural.,30.89,13,65
2479,generation,Investment really source eight. Cost onto result decide speak away campaign others.,63.75,94,100
2480,five,Smile while detail. Performance care simply. Discuss prove outside media. City news from.,28.3,99,33
2481,nature,Camera inside certainly represent trial sell situation. Yourself war drive quality.,830.72,17,23
2482,drive,Once relationship of situation per official plant. Peace whether table put there much will.,421.28,86,57
2483,speech,Low mention leader result.,595.34,37,28
2484,into,Check special travel cultural. Write bar hundred.,779.84,84,45
2485,show,I those material write yard concern. Blue employee subject push.,192.05,77,23
2486,white,Nearly indicate property station. Figure play value another.,108.78,64,50
2487,drive,Middle evidence close team back white once miss. Middle might challenge stage participant past.,214.08,15,50
2488,group,Tree myself individual movement four investment company activity.,415.64,73,42
2489,yes,Serve bar present pretty drug six raise. Program national scientist half.,388.85,44,70
2490,product,Customer why themselves catch. Apply up thought could will special state me.,977.41,98,59
2491,half,Yet protect court peace site once phone both. Main model fight allow me.,281.42,72,75
2492,south,Nation want never everything security. Hotel around card general cold Republican.,676.15,94,79
2493,maybe,Security yet note part theory already. Might begin among have wide you. Project full finally.,325.36,57,15
2494,store,Rest collection instead care interest all. Decision south seek concern piece professor.,147.67,87,21
2495,special,Contain himself dream wear guess although rule. Idea strong build billion trouble start reality.,567.46,79,63
2496,year,Cut evening between wear reach. Partner become others give money thank.,496.41,67,65
2497,professional,Member table unit become political key. Realize under pretty agency provide.,592.95,93,82
2498,whole,Lot yard natural before identify whom protect. Shoulder thing take. Though take understand end.,287.35,6,100
2499,know,"Fund seven no plant that. Responsibility discussion would.
Difficult statement four story mother.",84.41,60,78
2500,wind,Radio bag must. Material many or establish. Value nature language subject indeed maybe.,996.6,7,82
2501,economic,Agreement wish role blue. Side case might represent leader director us. Student down true them.,482.24,25,7
2502,already,World building if month. Hard debate can over.,574.6,80,76
2503,police,Over better financial religious mouth force pay soldier. Color chance account go.,206.19,82,67
2504,evidence,Message radio consider. Economy question defense tell future anyone.,968.1,78,3
2505,guess,Risk whose oil data whole group anyone. Indicate economy heart possible from if sure.,431.66,17,4
2506,check,Exactly plan agree wonder.,213.35,39,32
2507,such,Young run degree kind level page. Daughter least traditional. Seven above mind section.,511.26,52,68
2508,time,Clearly piece free blue ground help. Health see husband scientist.,856.33,27,10
2509,reduce,Thank artist early.,590.48,11,56
2510,energy,Reason professor particular nature. Hotel budget player house area nation.,595.68,31,94
2511,fight,Quality view the citizen. Want food organization.,581.13,1,93
2512,artist,Congress foot along important bill. Left street yourself method.,534.49,52,26
2513,four,Voice building management probably soon. Again best rise week. Away month family receive important.,248.82,84,23
2514,also,"Investment account popular herself million any data purpose.
Cultural low into.",922.06,47,13
2515,community,Get property deep parent. About garden list near. Very concern it head.,540.82,99,43
2516,guy,"Present box whom Mr. Very provide doctor indeed recent.
Risk voice foreign manager.",697.97,53,90
2517,particular,Base bill building act wonder admit. Four whom wear south surface.,618.93,65,46
2518,social,Along early organization rather must. Sell situation maintain official. Health test computer even.,289.99,94,87
2519,man,Let style either. International price thousand it who.,843.81,8,85
2520,seem,Usually pass everyone resource project Mr way. Decision president religious rise local.,551.52,16,13
2521,participant,Air budget peace least sport take. Throughout exactly past safe return likely natural.,847.36,31,27
2522,quickly,Run blue thus kind. Remain worker language south week.,502.65,36,88
2523,pretty,Feel call dream. Personal test entire never set use life. Coach raise owner work make statement.,344.89,97,69
2524,learn,"Hope memory arm sense all.
Six wind media single focus focus development pick.",686.75,48,29
2525,until,Analysis tell decide allow office wrong. Speak serious ready personal event economic life.,48.79,54,24
2526,see,Your successful easy would move. Ok boy usually other wife catch billion.,847.57,15,86
2527,campaign,Recognize control science again follow other.,137.23,95,62
2528,result,Page energy floor.,776.12,53,33
2529,bed,Beyond skill cup. Boy agreement describe relationship matter baby.,429.28,15,39
2530,in,Develop ball spend boy. As report current goal soldier artist.,948.73,91,67
2531,thought,Budget audience issue follow. Course animal two including score. Boy teach view them.,337.91,7,20
2532,people,Nearly laugh amount challenge decade choice maybe.,246.91,69,35
2533,camera,Never story player see. He challenge certain per.,241.99,42,89
2534,throw,Away become national build.,893.67,58,10
2535,tax,Hair of social many end side. Social resource finish perform.,852.64,38,88
2536,home,Line upon interest feeling consider fight city. Phone both meet almost person.,346.99,84,64
2537,blood,"Early might whom trouble for. Turn have military accept.
Chair future teacher wide.",97.48,5,86
2538,red,Significant join social health. Significant rest town site. Finish this another wide miss page.,602.9,95,1
2539,character,Military great friend heavy our do. Then involve there speak.,153.86,90,8
2540,close,Cut water if charge without. Surface size laugh second child term major.,60.62,77,99
2541,speak,Number nor especially coach while election. Argue most central find type know if crime.,454.05,32,71
2542,truth,Report east compare news could still onto. Discussion same remember child.,632.33,41,73
2543,president,Those view risk themselves along. Build thank affect particularly human international opportunity.,540.7,58,75
2544,right,Agency myself since stuff floor street.,208.11,30,51
2545,young,Until recently late letter hope. Plant western seat deal. Drop close mention fund.,489.55,22,34
2546,tax,More debate man back. Require story off grow notice life. Provide ahead prepare moment.,695.4,27,60
2547,within,About mouth performance seem past. Congress difficult four idea teach.,531.07,27,21
2548,former,Nice low finally compare quality actually prevent tell.,828.03,26,87
2549,continue,Trouble former employee partner large.,679.54,71,91
2550,themselves,One hope art treat write two. Industry person issue whether risk Democrat morning.,279.62,51,85
2551,may,Different seem suffer husband light sound control. Run old major black stage into born.,975.47,98,3
2552,go,Per fish several church both view product. Design receive ok affect rather yeah.,370.39,5,63
2553,reduce,Rock probably claim until tree southern. Agreement everyone soldier kid operation key head prepare.,336.73,86,48
2554,everybody,Individual firm watch the. Town final behavior defense sport hair.,613.21,26,32
2555,quickly,Provide station determine lay behavior.,117.54,67,65
2556,team,Visit should act lay reveal skill. Seven great south life remain feel near once.,576.93,50,18
2557,would,Interest dream school man open offer rest. Remember prove budget. Page learn southern kind.,954.69,1,82
2558,oil,Rule chance color. Brother different court what.,627.3,41,76
2559,both,Whose indicate top fall want. Wrong necessary tax cultural.,558.33,74,72
2560,southern,Stand stuff also miss. Must fire consider institution. Deal rise fast.,84.49,83,10
2561,company,Fear turn special clearly your specific executive. But professional throughout wrong voice.,587.54,4,1
2562,local,Nation because week image. Open mind tough thousand lose day six in.,922.3,35,6
2563,require,Return trip trip arm wish pull boy.,364.09,72,63
2564,walk,City else garden whether. Seem democratic form finish although prevent voice amount.,702.57,79,55
2565,employee,Across skin well. Away dark popular back economic part.,451.99,73,12
2566,positive,Organization argue change.,703.68,9,96
2567,or,Piece his option television leader seek finish.,738.16,44,74
2568,according,Chair on prepare large of future. Industry stop increase thus.,295.36,88,49
2569,compare,South life remain resource late. Two technology table red quickly.,452.17,9,88
2570,four,Money sea garden. Ok entire different human face cultural.,932.08,6,57
2571,yet,Agency wonder positive. Better yard because gas.,531.32,81,54
2572,theory,Which relate off start police TV. Any wish citizen bill each candidate close.,974.12,64,86
2573,computer,Official suffer member now. Commercial skill protect recognize today.,50.93,11,51
2574,peace,Husband again arrive magazine chance sell six. Unit policy lose clearly father.,610.23,93,24
2575,available,Direction check whom serious rather. Market common kid nothing make education someone.,887.66,37,91
2576,day,Indeed choice ground investment among once. Player necessary yeah pull point despite.,314.06,23,17
2577,not,Just suffer respond weight Democrat position production. Product thus student reveal.,875.27,95,31
2578,step,Number show industry author. Show age type billion. Enough people Mrs fact miss.,290.46,36,52
2579,trade,Population service own then rule. Next teach administration before continue appear card.,79.81,96,29
2580,room,Seven brother consumer word. Fire tell away size.,222.34,5,31
2581,international,Stock ground family own everybody set. Not under remain color direction.,613.43,22,51
2582,inside,West watch between determine official. Citizen yeah behavior. Scene development production.,379.88,69,11
2583,rise,Behavior cultural oil. Example enough rather others campaign. Change dream soon throughout.,428.73,33,4
2584,individual,Simple standard field get vote any meeting. Wall wall team group available much.,186.66,25,73
2585,discussion,Or child so fish message. Recent view ground true table lay.,130.55,45,8
2586,task,Reach sister sell population against who present. Improve law would shake writer break forget.,260.69,48,4
2587,foot,Job walk step act. These have last course citizen however again. Mind yard teacher medical stay.,164.82,72,58
2588,live,Improve find effect win school. Relationship be apply first.,489.05,32,59
2589,movement,Important read word. Score goal data soldier tree.,745.21,16,75
2590,reason,Fear beat practice least agree push. Skill care financial respond oil deep.,363.06,63,89
2591,clearly,West short suffer positive dream market city. Perform subject few lose might four information.,681.94,33,55
2592,imagine,Fall account news. Only food result series debate human.,31.47,34,50
2593,toward,Kid worry age indicate. Discover good without example door. Recently cold relate civil them.,695.34,83,100
2594,truth,Interesting ok thus this. Shake candidate moment finish spring player usually employee.,339.78,25,22
2595,current,Image law expect election culture glass sure. Customer around everybody one take everything low.,74.65,0,80
2596,appear,Cut again hard ask resource. Or fact field ball.,248.19,73,82
2597,section,Tend customer ask crime road like. Discover bar least trade capital back.,16.23,20,30
2598,thought,"Likely onto arrive woman before.
Performance perhaps follow. Marriage away poor others main simple.",329.94,54,79
2599,have,Bed start operation paper prevent. Develop vote mean mind Republican.,742.06,29,21
2600,give,Wrong involve sing thought can court. The us him rest debate.,503.18,78,63
2601,may,Drug fact significant manager. Well ok black difference specific religious lay.,348.14,68,71
2602,wind,All east practice democratic recognize mouth image. Realize recognize occur benefit college.,183.72,8,22
2603,professional,Environmental I executive. Today later time.,491.79,80,31
2604,many,Purpose them four that performance light serve. Worker attention common family against strong part.,746.74,71,35
2605,write,Card doctor plant article work. Skill company star until. How per organization summer allow.,980.38,82,15
2606,happy,"Move condition budget option election art model.
Right dark if turn half from citizen summer.",605.22,77,81
2607,at,Poor find themselves song. Just reason mouth pressure night. Whatever page she a cup near.,427.96,60,25
2608,science,Tax must name suddenly theory. Animal miss piece issue.,811.75,18,88
2609,including,Type than raise start team training fact. Successful view wish across house.,755.01,47,41
2610,those,"Pay many theory. Mind season better probably purpose data area interesting.
Security so need.",255.22,24,99
2611,risk,Rock chance animal. Interview sort point report in beat land.,205.8,75,36
2612,network,Political culture concern method drive ten single. Tree situation thank art.,144.57,45,86
2613,spring,Race would night assume account drop success. Later fill would keep step himself feeling campaign.,181.99,41,90
2614,trouble,Set debate nation response service through idea still. General per friend.,701.28,5,96
2615,series,Southern fact fund certainly company space add. Fact describe age mention.,627.07,57,70
2616,evening,Effect range room site create simply.,556.77,59,17
2617,hand,"Weight media rather. End during send.
Citizen anything right spend. Season those do.",908.73,98,69
2618,mouth,Town set week say left. Watch very forget commercial north stay.,389.34,30,43
2619,price,Reveal current explain involve Democrat role. Administration ahead chance morning reality window.,452.33,80,42
2620,month,Them computer yeah though. Situation amount arm return. Number effort meeting some within game.,500.91,96,87
2621,lay,Loss nearly catch. Activity four hour. Show easy prove life walk consumer specific.,520.9,68,96
2622,personal,Office however shake part so. Turn outside civil different past today consider attack.,771.58,14,96
2623,really,Everybody whom reflect. Serious we rest fire question.,910.93,70,6
2624,likely,Benefit husband assume future. Least several east room.,389.93,27,64
2625,moment,Red including also. Professional shake wife responsibility. Above pattern base all since.,891.18,58,25
2626,why,Entire house real. Effort person role if hair building. Toward agent keep concern game cover.,849.43,45,96
2627,sign,Visit look step lose opportunity. While rate according.,782.25,100,30
2628,watch,Decision anything involve fly future open forget. Whom reason vote each follow.,672.39,10,74
2629,argue,House society establish point. Ok wait term court technology mention president fish.,592.59,18,2
2630,civil,Pull easy stock stage value. Door list woman she. Player article space wrong.,822.04,12,95
2631,firm,Close position remain live without. Entire point serve be success part.,390.03,20,44
2632,safe,"Others against be water pick firm.
Quite herself friend lose time pay. Laugh of similar discover.",517.5,22,77
2633,term,Class explain change know.,417.34,74,26
2634,while,Dream last argue itself. Establish or table difficult continue. Pick strategy lead work defense.,402.62,4,58
2635,degree,Reality tough test force product. Space deep commercial growth quality.,994.3,52,86
2636,need,Concern above clearly. Fill detail much person now position wind. Discussion thus citizen.,876.03,59,15
2637,sea,Maybe hundred game man discussion.,654.67,6,2
2638,PM,"Me space economy brother rise step. Call floor compare door.
Plant situation foreign maintain man.",125.83,49,77
2639,size,Nice across the player. Up cultural create season along old.,366.93,46,5
2640,relationship,Soon best mean boy subject. Not step remain poor. Down attack art move use century image.,250.9,94,69
2641,crime,Indeed contain sister ready air. Thus never happen.,574.82,90,96
2642,staff,Around economic no run his. Training actually major rock information into pretty.,556.41,17,97
2643,employee,Most side identify political wife minute. There remember speak move.,88.5,37,29
2644,claim,"Artist official fight. Plant sport yourself line today.
Affect lose far.",556.64,24,63
2645,world,Film grow minute in represent medical. Bit continue summer before take share evidence particularly.,126.3,34,35
2646,rich,Shake author themselves Republican lawyer ability speech. Ground consumer you memory answer.,554.96,28,69
2647,cost,Determine clearly buy research mouth real write either. My sister peace court cup.,223.26,93,34
2648,employee,Few question main what cold fact senior. Century quality total statement simple many.,59.49,41,59
2649,else,Way plant land statement local him.,112.24,16,41
2650,charge,Soldier thousand American this building far. Morning significant sport day stage.,149.17,16,37
2651,operation,Identify build least night home. Industry right easy.,667.59,96,77
2652,somebody,National with news vote girl hot new several. See big military current however.,647.0,6,58
2653,doctor,Space politics forget walk way maybe. When you truth total top friend.,727.64,82,80
2654,into,Yes name fill. Marriage represent pay sit. On yes company meet.,880.89,82,56
2655,term,History yard east audience friend. Safe hospital large few themselves.,226.86,44,98
2656,thousand,Friend rich reduce who history. We wonder fly.,734.56,29,55
2657,discussion,Ahead tree pull not. Might decision business garden.,323.96,73,40
2658,financial,Write financial voice those attack Mrs. If grow seat ground.,372.41,62,93
2659,especially,Onto take which claim capital put food. Indicate chance forget reason when instead day nation.,211.32,68,78
2660,peace,Box it owner dream into late difficult environmental. Action account anyone teacher.,174.83,68,99
2661,fall,Authority clearly benefit happen page end food teach. Give occur take.,947.42,86,28
