ProductID,Name,Description,Price,StockQuantity,CategoryID
4793,job,Soon agency second hundred hold. Well far close great his including.,941.8,89,23
4794,shake,Grow important kind federal. Trade claim game score threat bad hand. Rise song no or clear.,368.97,69,64
4795,she,Question left against point benefit five. Enter Congress several trade between customer cause.,516.53,41,2
4796,likely,History PM southern share wait. Big wind none. Half room court successful type side nor.,727.74,47,28
4797,yard,Clearly always sign discover management bad at.,222.77,58,80
4798,reflect,Southern single play accept. Next exist control toward house Congress staff.,537.09,57,1
4799,listen,Early off listen yourself leader. Yeah box share use about sister Mr environment.,222.45,64,5
4800,project,Place commercial each consider report window. Program evidence other real particularly.,180.38,68,10
4801,force,Available nearly without never. Film write own capital east language.,524.93,76,77
4802,measure,Training interesting and him soldier type my. As claim culture old law year.,880.19,98,72
4803,approach,Certain recently natural top. Which project decision door.,356.94,58,1
4804,will,Study meet pay interview friend. Move mouth life anything step anyone dark.,472.67,5,90
4805,reduce,"Feel ability somebody no candidate rest. Buy modern former wind.
Most fear likely save.",642.1,42,31
4806,onto,Evening trouble way seek fund. High candidate finally team. So allow daughter political.,730.66,9,26
4807,go,American difficult your identify. Hope tree past energy better represent wait.,709.5,73,17
4808,join,Offer office sit machine. She decide management room more find machine.,825.57,67,97
4809,buy,Capital little medical section end by. Effect tough guy treat. Find only interview before.,637.56,44,60
4810,can,Garden difference whose seek.,245.34,7,31
4811,enter,Either capital notice wish. Scene wide daughter.,550.3,44,38
4812,either,Anything them apply blood. Student argue that sing social.,845.08,12,83
4813,beat,Strategy eight among. East believe property different our scientist.,921.81,16,36
4814,capital,Let trial Mrs purpose letter themselves tell. Worker left kid by accept brother walk step.,89.5,38,94
4815,son,Step myself half will above executive. Laugh hour police behind billion each miss.,265.93,38,74
4816,accept,Black office ahead bed. Necessary various security number score impact. Fish training still.,555.03,57,74
4817,realize,Box production analysis. Report lead continue away open.,792.64,2,25
4818,law,Board billion key deal. Surface set score again my out.,905.94,25,3
4819,herself,Church kind security sister. Right eight view prevent majority popular perform glass.,331.99,98,16
4820,science,Why entire network same.,793.03,10,65
4821,military,Cup billion value entire your he person industry. Mr table sport fill likely they.,426.54,28,8
4822,this,Cover need size different money should. Industry entire as administration public.,622.9,43,29
4823,staff,Fact cut piece deal tell hear. Around amount maintain base on why soldier.,686.59,42,43
4824,avoid,Yourself to behavior. State ball change plan. Senior medical way also.,986.22,77,54
4825,space,Design yeah whatever increase experience. Six concern low enter. Continue other own physical small.,876.01,53,66
4826,participant,Turn professional rate former message benefit. Even person mind again into gun.,511.16,75,59
4827,audience,Just research computer suffer. Stop current read young mission.,776.72,70,14
4828,growth,Maybe build its ok house quality person. Loss probably cover discussion.,163.13,77,97
4829,fast,Home performance guy cultural main keep while. Challenge yourself raise.,698.39,7,7
4830,rest,Serve series care over hundred. Movement pass writer image medical. War beat issue trip.,856.68,17,67
4831,that,Method take center any will avoid old. Prevent buy do size idea. Wind system spend performance.,977.06,96,68
4832,area,Care skill this place professor up.,965.59,18,11
4833,difference,According back government issue writer how adult product. Management run region.,610.5,47,72
4834,manager,May today choice put live sing. Like unit forget give rather morning catch.,700.97,67,79
4835,buy,Particularly activity individual industry. Box both coach.,46.7,40,89
4836,it,But body third develop talk. Remember structure rule skin whom. Big decide hit authority apply.,861.6,29,74
4837,seven,Without bit tax almost cost able list. Soldier forget talk manage occur anyone.,152.73,71,79
4838,lawyer,Employee want natural heart. Hold pick I prove pass apply party. Thousand concern growth clear.,640.83,42,11
4839,point,President three establish beyond drive she to candidate. Use throw it everyone help nation friend.,429.2,33,99
4840,it,Whose public whatever teacher. There speech goal itself be require.,382.92,21,68
4841,though,Wall idea yes. Green serious along woman process.,986.42,91,88
4842,situation,Something own discover place. Than actually program board. Page push impact sing rate issue.,538.07,72,66
4843,political,Early available once. Common per baby it cost. Dream ball fill sound bill share edge.,803.26,71,6
4844,rest,"Model simply employee.
What east should could. Respond affect huge.",239.0,65,51
4845,growth,Message power since large effort happen. Care size measure worry.,562.04,45,48
4846,democratic,Seem travel rest skin movement start institution. Very article finally million agreement week.,519.32,4,16
4847,avoid,Trip apply arrive society bill her. Already school first weight black.,927.94,17,62
4848,town,Card why one sometimes. Player painting dream.,495.69,54,14
4849,product,Finish whom food hospital fine middle at. Fly represent score home choose share property.,235.26,12,89
4850,threat,Big why that charge management. Speech appear current charge cost.,557.86,12,71
4851,exactly,Probably language later language you certain role. Police side although three culture.,266.04,89,24
4852,rather,Chair but film speech. Left can song at any. Hundred affect better herself still.,314.9,9,2
4853,plan,Sea book will that hundred through company since.,362.46,96,11
4854,mouth,City wish recently including.,102.56,46,72
4855,before,Television read play experience debate thousand cup maybe.,35.54,15,84
4856,let,President free note task company information. City tend follow subject mother lead.,551.63,22,32
4857,tree,Well run bar sister want enjoy religious. Network main control here explain simple bed.,845.41,7,58
4858,always,Piece listen risk story. Few guess ball inside particular white brother.,120.51,100,74
4859,fish,Environmental religious law specific. Enjoy include any.,607.95,96,35
4860,wind,Total lead something whom. This theory few ability president. Care hold movement.,173.48,89,87
4861,before,Chance language physical beautiful fire thing. Start officer home college learn.,852.83,76,54
4862,none,Party culture reduce likely response. State throughout whatever add station.,997.86,8,29
4863,phone,Price not own seat. Degree officer support evening his. Wrong purpose strong.,253.07,76,75
4864,fast,Day walk wait consider investment herself. Third relationship daughter say whom.,203.3,89,85
4865,dog,Significant style place mean discussion agent central.,272.69,46,24
4866,building,"Final field painting force foot food or. About try production thank.
Among arrive at.",180.26,58,31
4867,prove,"Popular generation by. Practice miss fact shoulder.
Act next them difference require between.",59.92,63,4
4868,language,Individual authority respond. Pm vote threat future by day today dog.,17.11,48,83
4869,realize,Event into north hope wait compare section. Threat court agree rock go.,295.82,13,4
4870,budget,Rich cover policy share question floor attorney. Each idea agree those maintain second collection.,667.05,66,4
4871,want,Off health well energy left rest condition.,820.47,65,48
4872,protect,Ground since budget dog feeling them. Social suddenly strategy customer great moment president.,717.0,21,72
4873,especially,Case central lawyer agree. Control money southern next fact military indeed.,132.98,33,12
4874,game,Us right color magazine through indeed. Its into nature for.,767.15,83,93
4875,fear,Material safe station. Consider president middle others move lead cell.,932.2,99,50
4876,national,Cause show sell church power old political very. Question none imagine. Road customer mention.,809.29,14,73
4877,list,Now discover entire trial. Where trip no old key seek.,792.19,52,61
4878,argue,Suffer case travel structure. Exist particularly any happen mouth ground.,367.85,25,4
4879,task,Attention support upon actually. Site rock answer letter walk they part.,69.34,86,34
4880,bed,Republican if camera leader.,497.33,84,32
4881,me,Hundred relationship small move cover. Lawyer treatment possible produce year evidence.,771.89,15,38
4882,treatment,As experience wear up only. Six much around however type including. Soon college director protect.,264.31,31,8
4883,order,"Pm customer interview almost.
Thought standard truth. Standard number that with view situation.",418.16,6,45
4884,interest,Buy body report environment. Certain little truth like large find. Care middle miss several father.,371.4,92,2
4885,through,None democratic across usually left course decide. Air field wide debate.,751.77,97,23
4886,until,"There attack boy prove pattern pay.
Agreement lot there these quality. Design or democratic bad.",463.06,15,88
4887,fire,Customer summer imagine personal.,353.34,85,5
4888,community,Drop guy which feel door beautiful just word. Art term people by while money security.,208.46,44,67
4889,employee,Ago bag though. Simply century hope interest.,916.15,81,76
4890,school,Plant local property represent environment shoulder morning. Fund image tough indeed situation.,356.01,35,32
4891,security,Hair beat customer yet reveal. Mouth exist through or it. Buy last vote ground.,502.6,59,86
4892,office,Research state edge see education none organization. Be you year entire certain necessary impact.,478.59,60,20
4893,because,Military also and present early. Position process they race over threat public.,463.69,65,25
4894,foot,Identify stage nearly know author.,548.48,58,41
4895,energy,Team field story tax minute put. Heavy must free theory.,865.73,31,90
4896,practice,Wall because group him bad. Him move the near near even political. Police those try color she.,593.46,96,2
4897,realize,Choice us husband thousand central buy others career. Ahead bag TV.,360.0,100,24
4898,article,Government table blood scientist car discussion. South operation hear reach make fall.,590.87,50,65
4899,difficult,Smile politics since high analysis front down machine.,985.67,20,9
4900,worker,Spend continue recently read parent fight represent.,367.16,40,75
4901,last,Since pass walk service expert picture. Them scientist shoulder deal use worker change.,991.98,83,34
4902,everything,Card church trouble capital particularly growth share those. Us loss another report.,279.19,43,23
4903,detail,Particularly campaign section maybe social technology. Majority career side hospital up company.,442.98,52,20
4904,draw,Including different edge much huge always positive. Pm tonight despite than three goal federal.,939.6,8,24
4905,peace,Chance interview cell whose board. Memory moment consumer tough.,633.52,7,24
4906,across,Suddenly officer increase forget. Really us skill save reduce talk away.,711.74,67,79
4907,none,More green a factor career receive. Enjoy note stage.,888.1,5,37
4908,actually,If product past really action. Apply effort step son throw carry today. Old analysis lot song I.,780.0,59,46
4909,rise,Level politics lay family turn Republican option. High explain value herself turn.,525.5,57,18
4910,could,Tell above remain she. Recently together at serve right. Dark mention check anything.,179.21,15,69
4911,now,Before road where live office thousand. Still hospital against project reveal a field.,740.3,19,69
4912,ready,Difficult huge race project listen modern compare.,322.32,60,59
4913,nearly,Include believe enough seem. Work level really light Republican call.,872.2,62,77
4914,else,Special international discuss. Moment food Republican nor discuss.,943.81,50,24
4915,real,The I hour way me hotel. What however reality not use least around become.,548.56,48,42
4916,message,Success success Mr plant bag it. Century ok operation experience shoulder maintain happy claim.,164.45,35,36
4917,medical,Report consider career character worry military wonder. Body focus ahead.,972.83,16,22
4918,dog,Shake fire local expect happy town. Practice should future.,214.28,75,91
4919,it,Actually step like those. Certainly authority pick month whole such between.,258.76,15,90
4920,her,Many seat real grow else western environment me. Story company spend.,962.71,10,60
4921,officer,Left discuss wide may toward. Watch truth building player fire.,472.24,19,67
4922,service,Fish policy toward born community.,497.73,71,29
4923,executive,Project rather several space consumer police. Couple TV PM star.,500.09,2,98
4924,major,Project energy nearly quality bit race. Everybody woman three easy arrive.,212.1,56,39
4925,name,Group across building million remember. Need down each ever education line.,864.76,53,50
4926,who,Hot better trip same. Degree compare chair trip star. Bring fast woman tree bag.,3.51,1,54
4927,authority,Stuff food people talk wrong. Skin lay including form determine investment up.,683.77,81,37
4928,quality,Us wonder law themselves situation back next. Grow house drop anything.,44.74,83,44
4929,by,Through water run any reality situation. His should he something face.,187.67,38,56
4930,sister,Force on decide possible spend real should. Person deal coach city. Effect happen direction.,442.65,10,66
4931,theory,Wide stock draw itself state. Sea mother rather certain view. Unit management low.,810.08,81,59
4932,fine,Writer explain seven candidate future try. Would but real government.,859.72,45,31
4933,daughter,Institution environment true short. Hear safe might beat beautiful.,267.38,64,37
4934,fill,Imagine sell win head. Add together about trial seat fund.,584.49,71,58
4935,arrive,Act glass mean production treatment prevent section. Not discuss develop.,165.55,72,10
4936,hear,Officer watch court place industry believe able.,527.05,33,38
4937,technology,Five small cause defense. Serve among enjoy president approach.,771.01,100,3
4938,itself,Since us play. Surface local describe. Result measure position.,20.96,9,27
4939,citizen,Feel soon sing. Than move relationship audience trial wall car. Trip role bank.,315.8,90,54
4940,drug,It store learn explain safe. Power take these young democratic analysis but either.,72.15,7,31
4941,if,The experience good challenge television. First push candidate market say sound.,283.53,64,70
4942,wish,Drop protect type clearly animal. Election official near Congress guy international discuss.,971.2,98,20
4943,best,All never recognize image imagine. Rock owner chair growth beautiful health education.,904.84,44,79
4944,difficult,Unit alone throughout result pick. Learn across nor ok.,771.31,62,47
4945,foot,Someone toward report surface school ability age difficult. Hear clearly end husband discover.,504.28,44,69
4946,size,Stop process good reduce. Base task bill sister.,392.01,87,74
4947,serve,Perhaps mother those serious benefit know. At Congress day north best area.,509.93,20,84
4948,still,About main interest. Certainly room side staff.,817.0,34,94
4949,hour,Tv sell few. Radio number Democrat candidate. Main remain whatever pull opportunity wait.,469.99,49,52
4950,all,Dark her onto herself member away. Might enjoy manager table window.,980.27,45,3
4951,order,Particular wall bar system board.,667.69,23,72
4952,rate,Draw story challenge skill enter.,797.92,93,76
4953,sign,Rest mind so save. Remember traditional help mouth. What sense for act reach environmental.,690.76,48,96
4954,others,Method appear fly day rather. Personal mean hospital good. To throw continue major style serve.,681.07,17,34
4955,help,Maintain situation participant. Tax notice hear likely model more mission.,17.17,74,55
4956,bar,Control large peace majority agent them.,620.16,24,87
4957,goal,And start end arm. Suddenly necessary person rule. Magazine this effort year in research foot.,379.76,7,11
4958,leg,Group more can industry current. Bar issue start ability wind case.,632.86,14,37
4959,appear,Sign stock example design. Explain top go middle. Floor any strategy happy whom.,197.91,45,54
4960,simply,Source plant share describe. Table less agency hear social why. Civil start suggest.,727.18,44,97
4961,receive,Rather consumer left.,371.47,1,9
4962,paper,Just red decade history under be soldier. Role above yourself behind know.,268.03,98,71
4963,provide,Something possible for change foreign. Human open there trial part. Top once play happen.,389.7,65,46
4964,last,Necessary he these early visit despite. Family relate reality bar get. Next eye model.,343.48,81,50
4965,unit,Society impact once someone production gun buy. Nearly travel lawyer discover full.,176.63,50,35
4966,quickly,Gun force now wish. Scientist land stock son record strong. Good paper door choose moment surface.,267.35,58,89
4967,tell,However rather fund. Air address hotel clear leave.,738.27,17,73
4968,star,Name could toward page picture seat because. Only word college account suffer day whom.,244.31,77,50
4969,safe,Through blood popular. Generation control say drive.,894.54,82,58
4970,same,Ask listen page cultural part. Me appear could.,459.04,74,43
4971,race,Discussion fly scene meet improve. Various whatever interesting break manage.,318.06,34,16
4972,continue,Trip local indicate single career summer. The effect attack administration surface.,924.48,36,41
4973,pressure,Task eye night contain believe eight trouble. Measure unit behavior claim seek perform.,201.87,8,26
4974,news,Determine unit team parent the past race building. Attack minute myself glass resource.,876.21,53,63
4975,ball,Society develop program degree picture spend. Inside fall herself alone individual.,151.7,79,73
4976,really,"Easy economy particularly trial. Carry civil American cut.
Style produce fish those help toward.",8.3,45,16
4977,put,Station animal and remember few much.,211.98,93,54
4978,face,One music address court. Include city exactly firm side pressure sure.,109.47,64,72
4979,business,"Phone road sign sing center.
Fight address truth hear. Meet their half wonder.",421.47,11,89
4980,get,Follow customer deal news painting for forget. Begin throw cup leg physical administration.,696.91,96,58
4981,production,"Much left water person respond impact.
Couple force guess camera baby reduce.",464.84,29,33
4982,southern,By however own put hot turn. Task future official throw. Respond fill piece morning.,899.21,8,22
4983,plan,Western game build television agree also new. Lead cause firm space.,85.4,84,68
4984,character,Least son especially throw born fight book quickly. Public real drive serious first.,611.32,62,18
4985,born,Road lay Mrs prove with.,410.35,3,67
4986,military,Baby suggest produce poor option. Way personal beat nor. My data collection couple.,151.14,64,41
4987,act,Small sure customer son none way. Scientist away continue leave.,269.28,21,67
4988,white,Enjoy mother mind join southern. More structure information reach. Maybe seem meeting.,14.61,50,56
4989,box,Figure throw forward all method. Probably later feeling change face Congress.,569.79,44,13
4990,support,Interest hospital any firm. Couple subject western trial walk recent.,873.76,24,38
4991,will,Black sister clear. Effect per theory reduce. Base director point character total participant.,540.13,39,73
4992,development,Democratic glass difference social. Other own send major beautiful draw without purpose.,495.18,78,10
4993,modern,Decide exactly spend we act skill. How a material paper ability sister top.,119.09,31,51
4994,him,Short process along amount work time produce. Painting whose reach structure test.,368.0,67,48
4995,box,Hair movement modern daughter young. Government amount parent paper past wear.,94.34,35,18
4996,past,However figure source citizen remain program. Prove sit operation thought final main cause.,553.39,30,90
4997,form,Month others name well never. Tax accept more economy while whether. Expect hope maybe above any.,230.47,90,52
4998,question,Couple local why push. Artist security accept paper four news machine player.,875.23,61,19
4999,much,Eye investment movement clearly teacher. North pretty shoulder any sure. Region then wait as.,976.25,50,27
5000,country,Start line girl surface drive event.,722.06,38,77
5001,and,Run painting matter leader. Law camera notice choice person.,469.31,58,47
5002,force,Himself various at course concern family. Among president business little.,839.51,97,27
5003,program,Notice card fund activity food happy gas establish. Employee thus town blood.,112.67,63,85
5004,source,"Act imagine wish keep very value along.
Difficult now police read learn radio eight.",562.54,14,81
5005,far,Then inside argue available exactly start. Region as middle voice music traditional.,459.44,49,31
5006,back,Usually son full bit response stay sister.,157.57,24,100
5007,south,Agreement significant how popular technology bad born. Boy just various guy all fear face.,557.5,87,23
5008,responsibility,Garden modern start subject away. While teach material medical. Drop future PM us.,409.25,41,21
5009,assume,"Face top nice. Share town what fast.
Hit human follow especially. Everybody will green dark.",261.41,41,78
5010,book,Red either mean agent hear back alone.,312.14,68,57
5011,available,Ask wish meet question amount. Explain here reveal sort democratic travel personal.,664.9,82,75
5012,beyond,Source cold necessary little. Front language today others sort election.,914.52,53,64
5013,one,Eye among former film fill successful as. Break story draw spring.,541.88,57,37
5014,call,Stand peace thus onto begin. Hand company relate he believe attorney.,700.95,22,69
5015,answer,Stay us onto size great on game. Newspaper indicate southern home what full deal.,76.95,47,26
5016,physical,Yard past my style.,396.71,60,13
5017,game,"Method on near law agree type each best. How information usually.
Close finish sister senior skin.",629.83,39,34
5018,far,Be lead less. Police sit education do day near their. Well network trouble source reduce.,457.12,32,93
5019,and,Participant edge bit but. Deep whom leave material.,222.25,40,8
5020,within,Physical none clearly debate relationship dinner make. Mind table see while everything.,829.58,33,78
5021,feel,Prepare quite then for interesting. Mrs fall company game official. After base respond citizen.,858.7,84,14
5022,into,Natural blue program list. Because within open identify market many laugh.,656.53,0,46
5023,brother,Program member decide receive task popular any.,854.19,96,16
5024,community,Natural wide their carry week Mrs. For try during technology collection by. Behind drug hour.,791.99,90,49
5025,station,It people area degree sit.,601.79,51,27
5026,skin,Identify seek soon. Wall imagine become enough them certainly party.,433.1,44,39
5027,color,Region gas face suggest. Usually culture production too.,373.93,91,45
5028,general,Commercial practice generation hope. Age his size medical person just.,428.04,96,52
5029,billion,Issue our into kid energy. Agent of decide energy. Way toward beat consider look it court.,174.6,37,21
5030,PM,Small vote wide movie teacher. Prepare poor home then debate.,437.71,83,21
5031,price,Film know amount ground traditional relate. Well apply seem military health water.,672.44,62,21
5032,trial,Green cost partner lose wall send. Him wish already enjoy spend mean.,272.02,71,14
5033,mission,Use commercial eight officer assume space kind. Out I relationship nearly fill.,985.9,1,37
5034,action,Only yard close worry opportunity tax. Letter order artist stop old prevent.,760.43,96,11
5035,arrive,Yard be moment window. Bill goal perhaps. Live Democrat suddenly line whether social speak.,124.7,25,81
5036,help,Effect without fast different wrong her many. Century stock one.,549.68,6,36
5037,general,Chance anyone still home. Myself role hand participant.,253.56,72,60
5038,station,Hotel lot message theory article agreement. Force sure training thought.,291.65,81,80
5039,learn,Skin everything test administration herself hand art.,219.5,14,16
5040,realize,Every per everything table training surface. Have else agreement fish executive nothing next.,622.48,73,24
5041,yeah,Computer market care grow generation left since. Left message suffer today table support art.,501.07,19,49
5042,cultural,Although member film same interview doctor sort. Science team everyone purpose indeed.,293.37,38,20
5043,try,"Must left rest she.
Push party guess yard. Capital a deal a down with.",909.3,30,90
5044,focus,Choose across weight east medical represent large.,636.42,39,37
5045,hope,Sometimes before name join knowledge manager. Who him middle project turn early new.,440.23,90,26
5046,bar,However finish every society concern. Sport public thus exactly say though.,562.55,82,50
5047,assume,Look painting design.,454.11,24,8
5048,financial,Difference new what month down recent sure.,831.77,85,17
5049,together,Painting action road its your. State others cause.,117.39,47,15
5050,room,"Parent care seat. Particular cold small your.
Local city example style. Happy we skill traditional.",844.67,62,41
5051,hospital,Benefit peace show last serious develop poor without. Page sit official rather senior son.,866.09,25,76
5052,arm,"Full agency drive build understand edge garden.
Base order out former foot. Human officer along.",857.83,83,27
5053,do,Realize left south material. Alone often plan threat allow set degree travel.,856.6,35,88
5054,region,Eye pick even exactly. Lot hospital national under stay.,420.94,27,13
5055,professional,Real fill store you Congress song. Form talk close pattern ok evening.,353.53,71,5
5056,why,Large room thank interesting.,520.65,61,92
